<?xml version="1.0" encoding="UTF-8"?>
<dataroot xmlns:od="urn:schemas-microsoft-com:officedata" xmlns:xsi="http://www.w3.org/2001/XMLSchema-instance"  xsi:noNamespaceSchemaLocation="72_ItemConceptSystemMapping.xsd" generated="2025-07-15T15:44:56">
<_x0037_2_ItemConceptSystemMapping>
<ItemStemConceptSystemMapID>52</ItemStemConceptSystemMapID>
<ItemStemConceptID>84</ItemStemConceptID>
<SystemID>1</SystemID>
<Code>SCTID: 420038007</Code>
<LocalDescription>feeling unhappy</LocalDescription>
</_x0037_2_ItemConceptSystemMapping>
<_x0037_2_ItemConceptSystemMapping>
<ItemStemConceptSystemMapID>53</ItemStemConceptSystemMapID>
<ItemStemConceptID>85</ItemStemConceptID>
<SystemID>1</SystemID>
<Code>SCTID: 26677001</Code>
<LocalDescription>sleep pattern disturbance</LocalDescription>
</_x0037_2_ItemConceptSystemMapping>
<_x0037_2_ItemConceptSystemMapping>
<ItemStemConceptSystemMapID>54</ItemStemConceptSystemMapID>
<ItemStemConceptID>84</ItemStemConceptID>
<SystemID>1</SystemID>
<Code>SCTID: 1217332007</Code>
<LocalDescription>persistent sadness</LocalDescription>
</_x0037_2_ItemConceptSystemMapping>
<_x0037_2_ItemConceptSystemMapping>
<ItemStemConceptSystemMapID>55</ItemStemConceptSystemMapID>
<ItemStemConceptID>85</ItemStemConceptID>
<SystemID>1</SystemID>
<Code>SCTID: 53888004</Code>
<LocalDescription>disturbance in sleep behavior</LocalDescription>
</_x0037_2_ItemConceptSystemMapping>
<_x0037_2_ItemConceptSystemMapping>
<ItemStemConceptSystemMapID>56</ItemStemConceptSystemMapID>
<ItemStemConceptID>21</ItemStemConceptID>
<SystemID>1</SystemID>
<Code>SCTID: 26677001</Code>
<LocalDescription>sleep pattern disturbance</LocalDescription>
</_x0037_2_ItemConceptSystemMapping>
<_x0037_2_ItemConceptSystemMapping>
<ItemStemConceptSystemMapID>57</ItemStemConceptSystemMapID>
<ItemStemConceptID>12</ItemStemConceptID>
<SystemID>1</SystemID>
<Code>SCTID: 1217332007</Code>
<LocalDescription>persistent sadness</LocalDescription>
</_x0037_2_ItemConceptSystemMapping>
<_x0037_2_ItemConceptSystemMapping>
<ItemStemConceptSystemMapID>58</ItemStemConceptSystemMapID>
<ItemStemConceptID>31</ItemStemConceptID>
<SystemID>1</SystemID>
<Code>SCTID: 102912007</Code>
<LocalDescription>fear of death</LocalDescription>
</_x0037_2_ItemConceptSystemMapping>
<_x0037_2_ItemConceptSystemMapping>
<ItemStemConceptSystemMapID>59</ItemStemConceptSystemMapID>
<ItemStemConceptID>10</ItemStemConceptID>
<SystemID>1</SystemID>
<Code>SCTID: 28669007</Code>
<LocalDescription>anhedonia</LocalDescription>
</_x0037_2_ItemConceptSystemMapping>
<_x0037_2_ItemConceptSystemMapping>
<ItemStemConceptSystemMapID>60</ItemStemConceptSystemMapID>
<ItemStemConceptID>4</ItemStemConceptID>
<SystemID>1</SystemID>
<Code>SCTID: 67698009</Code>
<LocalDescription>obsessional thoughts</LocalDescription>
</_x0037_2_ItemConceptSystemMapping>
<_x0037_2_ItemConceptSystemMapping>
<ItemStemConceptSystemMapID>61</ItemStemConceptSystemMapID>
<ItemStemConceptID>5</ItemStemConceptID>
<SystemID>1</SystemID>
<Code>SCTID: 64336009</Code>
<LocalDescription>incoherent thinking</LocalDescription>
</_x0037_2_ItemConceptSystemMapping>
<_x0037_2_ItemConceptSystemMapping>
<ItemStemConceptSystemMapID>62</ItemStemConceptSystemMapID>
<ItemStemConceptID>6</ItemStemConceptID>
<SystemID>1</SystemID>
<Code>SCTID: 67698009</Code>
<LocalDescription>obsessional thoughts</LocalDescription>
</_x0037_2_ItemConceptSystemMapping>
<_x0037_2_ItemConceptSystemMapping>
<ItemStemConceptSystemMapID>63</ItemStemConceptSystemMapID>
<ItemStemConceptID>23</ItemStemConceptID>
<SystemID>1</SystemID>
<Code>SCTID: 247963001</Code>
<LocalDescription>compulsive checking</LocalDescription>
</_x0037_2_ItemConceptSystemMapping>
<_x0037_2_ItemConceptSystemMapping>
<ItemStemConceptSystemMapID>64</ItemStemConceptSystemMapID>
<ItemStemConceptID>37</ItemStemConceptID>
<SystemID>2</SystemID>
<Code>A</Code>
<LocalDescription>Excessive anxiety and worry more days than not for at least 6 months</LocalDescription>
</_x0037_2_ItemConceptSystemMapping>
<_x0037_2_ItemConceptSystemMapping>
<ItemStemConceptSystemMapID>65</ItemStemConceptSystemMapID>
<ItemStemConceptID>12</ItemStemConceptID>
<SystemID>2</SystemID>
<Code>A1</Code>
<LocalDescription>Depressed mood most of the day nearly every day</LocalDescription>
</_x0037_2_ItemConceptSystemMapping>
<_x0037_2_ItemConceptSystemMapping>
<ItemStemConceptSystemMapID>66</ItemStemConceptSystemMapID>
<ItemStemConceptID>35</ItemStemConceptID>
<SystemID>2</SystemID>
<Code>A1</Code>
<LocalDescription>Recurrent unexpected Panic Attacks</LocalDescription>
</_x0037_2_ItemConceptSystemMapping>
<_x0037_2_ItemConceptSystemMapping>
<ItemStemConceptSystemMapID>67</ItemStemConceptSystemMapID>
<ItemStemConceptID>45</ItemStemConceptID>
<SystemID>2</SystemID>
<Code>A</Code>
<LocalDescription>Marked fear/anxiety about social situations where individual is exposed to unfamiliar peole or to possible scrutiny by others. Fears they will act in a way or show anxiety symptoms that will be humiliating or embarassing.</LocalDescription>
</_x0037_2_ItemConceptSystemMapping>
<_x0037_2_ItemConceptSystemMapping>
<ItemStemConceptSystemMapID>68</ItemStemConceptSystemMapID>
<ItemStemConceptID>7</ItemStemConceptID>
<SystemID>2</SystemID>
<Code>A1</Code>
<LocalDescription>Recurrent excessive distress when anticipating/experiencing separation from home or other major attachment figures</LocalDescription>
</_x0037_2_ItemConceptSystemMapping>
<_x0037_2_ItemConceptSystemMapping>
<ItemStemConceptSystemMapID>69</ItemStemConceptSystemMapID>
<ItemStemConceptID>10</ItemStemConceptID>
<SystemID>2</SystemID>
<Code>A2</Code>
<LocalDescription>Markedly diminished interest or pleasure in all or almost all activities most of the day, nearly every day</LocalDescription>
</_x0037_2_ItemConceptSystemMapping>
<_x0037_2_ItemConceptSystemMapping>
<ItemStemConceptSystemMapID>70</ItemStemConceptSystemMapID>
<ItemStemConceptID>26</ItemStemConceptID>
<SystemID>2</SystemID>
<Code>A</Code>
<LocalDescription>Marked fear/anxiety about social situations where individual is exposed to unfamiliar peole or to possible scrutiny by others. Fears they will act in a way or show anxiety symptoms that will be humiliating or embarassing.</LocalDescription>
</_x0037_2_ItemConceptSystemMapping>
<_x0037_2_ItemConceptSystemMapping>
<ItemStemConceptSystemMapID>71</ItemStemConceptSystemMapID>
<ItemStemConceptID>14</ItemStemConceptID>
<SystemID>2</SystemID>
<Code>A</Code>
<LocalDescription>Marked fear/anxiety about social situations where individual is exposed to unfamiliar peole or to possible scrutiny by others. Fears they will act in a way or show anxiety symptoms that will be humiliating or embarassing.</LocalDescription>
</_x0037_2_ItemConceptSystemMapping>
<_x0037_2_ItemConceptSystemMapping>
<ItemStemConceptSystemMapID>72</ItemStemConceptSystemMapID>
<ItemStemConceptID>8</ItemStemConceptID>
<SystemID>2</SystemID>
<Code>A1</Code>
<LocalDescription>Recurrent excessive distress when anticipating/experiencing separation from home or other major attachment figures</LocalDescription>
</_x0037_2_ItemConceptSystemMapping>
<_x0037_2_ItemConceptSystemMapping>
<ItemStemConceptSystemMapID>73</ItemStemConceptSystemMapID>
<ItemStemConceptID>4</ItemStemConceptID>
<SystemID>2</SystemID>
<Code>A_O</Code>
<LocalDescription>Presence of obsessions: recurrent/persistent thoughts, urges, or images that are experienced as intrusive and unwanted that cause marked anxiety/distress. Individual attempts to ignore or suppress such thoughts, urges or images or to neutralize them with </LocalDescription>
</_x0037_2_ItemConceptSystemMapping>
<_x0037_2_ItemConceptSystemMapping>
<ItemStemConceptSystemMapID>74</ItemStemConceptSystemMapID>
<ItemStemConceptID>21</ItemStemConceptID>
<SystemID>2</SystemID>
<Code>A4</Code>
<LocalDescription>Insomnia or hypersomnia nearly every day</LocalDescription>
</_x0037_2_ItemConceptSystemMapping>
<_x0037_2_ItemConceptSystemMapping>
<ItemStemConceptSystemMapID>75</ItemStemConceptSystemMapID>
<ItemStemConceptID>46</ItemStemConceptID>
<SystemID>2</SystemID>
<Code>A</Code>
<LocalDescription>Marked fear/anxiety about social situations where individual is exposed to unfamiliar peole or to possible scrutiny by others. Fears they will act in a way or show anxiety symptoms that will be humiliating or embarassing.</LocalDescription>
</_x0037_2_ItemConceptSystemMapping>
<_x0037_2_ItemConceptSystemMapping>
<ItemStemConceptSystemMapID>76</ItemStemConceptSystemMapID>
<ItemStemConceptID>42</ItemStemConceptID>
<SystemID>2</SystemID>
<Code>A</Code>
<LocalDescription>Excessive anxiety and worry more days than not for at least 6 months</LocalDescription>
</_x0037_2_ItemConceptSystemMapping>
<_x0037_2_ItemConceptSystemMapping>
<ItemStemConceptSystemMapID>77</ItemStemConceptSystemMapID>
<ItemStemConceptID>29</ItemStemConceptID>
<SystemID>2</SystemID>
<Code>A1</Code>
<LocalDescription>Recurrent unexpected Panic Attacks</LocalDescription>
</_x0037_2_ItemConceptSystemMapping>
<_x0037_2_ItemConceptSystemMapping>
<ItemStemConceptSystemMapID>78</ItemStemConceptSystemMapID>
<ItemStemConceptID>17</ItemStemConceptID>
<SystemID>2</SystemID>
<Code>A3</Code>
<LocalDescription>Significant weight loss or weight gain</LocalDescription>
</_x0037_2_ItemConceptSystemMapping>
<_x0037_2_ItemConceptSystemMapping>
<ItemStemConceptSystemMapID>79</ItemStemConceptSystemMapID>
<ItemStemConceptID>23</ItemStemConceptID>
<SystemID>2</SystemID>
<Code>A_C</Code>
<LocalDescription>Repetitive behaviors or mental acts that the individual feels driven to perform in response to an obsession or according to rules that must be applied rigidly. </LocalDescription>
</_x0037_2_ItemConceptSystemMapping>
<_x0037_2_ItemConceptSystemMapping>
<ItemStemConceptSystemMapID>80</ItemStemConceptSystemMapID>
<ItemStemConceptID>24</ItemStemConceptID>